0,Word,Definition,Example,Weight,Marked
208,aloof,not friendly or forthcoming; cool and distant,they were courteous but faintly aloof,6,false
209,clangor,a continuous loud banging or ringing sound,he went deaf because of the clangour of the steam hammers,6,false
210,conventional,based on or in accordance with what is generally done or believed,Most food tastes better when it is cooked in a conventional oven,6,false
211,debunk,expose the falseness or hollowness of an idea or belief,she debunks all the usual rubbish about acting,6,false
212,diminutive,extremely or unusually small,She has diminutive hands for an adult,6,false
213,discernible,"able to be recognized, identified or distinguished","Though the differences were often quite subtle, they were still discernible enough by tribesmen",6,false
214,enigmatic,difficult to interpret or understand; mysterious,he took the money with an enigmatic smile,6,false
215,estranged,no longer close or affectionate to someone,Harriet felt more estranged from her daughter than ever,6,false
216,extravagant,lacking restraint in spending money or using resources,The couple lived a very simple life with no need for extravagant purchases,6,false
217,fanciful,over-imaginative and unrealistic,"Because she had a wild imagination, she loved to create fanciful stories in her spare time.",4,false
218,heterogeneous,diverse in character or content,This consists of a medley of documents of the most heterogeneous character.,6,false
219,imperious,arrogant and domineering,The imperious manner of Andros made him many enemies.,5,false
220,impertinent,without respect; rude; irrelevent,"I hope you will excuse me for doing what is only my duty, although it may appear impertinent",5,false
221,invasive,tending to spread very quickly and undesirably or harmfully,patients suffering from invasive cancer,6,false
222,irresolute,showing or feeling hesistancy; uncertain,she stood irresolute outside his door,5,false
223,laudable,deserving praise,"laudable though the aim might be, the results have been criticized",6,false
224,lax,"not sufficiently strict, severe or careful; relaxed",Never let go of that privacy or be lax with your security,6,false
225,panache,flamboyant confidence of style or manner,He entered London society with great panache,6,false
226,plodding,slow-moving and unexciting,I could hear my roommate plodding up the steps to our apartment,6,false
227,prosaic,lacking imaginativeness or originality; commonplace,A very prosaic explanation of this nocturnal noise is given by Judson,5,false
228,remedial,giving or intended as a remedy or cure,Officials have pledged remedial action to repair damaged bridges,7,false
229,restive,"unable to remain still, silent, or submissive, especially because of boredom or dissatisfaction",the crowd had been waiting for hours and many were becoming restive,6,false
230,stigmatize,describe or regard as worthy of disgrace or great disapproval,the institution was stigmatized as a last resort for the destitute,6,false
231,undermine,"lessen the effectiveness, power, or ability of, especially gradually or insidiously",this could undermine years of hard work,6,false
232,utterly,completely and without qualification; absolutely,He found the experience utterly humiliating,6,false
233,weary,tired,"he gave a long, weary sigh",6,false
234,zealous,having great energy or enthusaism in pursuit of a cause or an objective,The police were zealous in their pursuit of the criminals,6,false
235,aesthetic,concerned with beauty or the appreciation of beauty,the pictures give great aesthetic pleasure,5,false
236,affectation,"behaviour , speech or writing that is pretentious and designed to impress","She's beautiful, truthful, and hilarious, without vanity or affectation , exceptionally clever",4,false
237,alleviate,"making (suffering, deficiency or a problem) less severe","he couldn't prevent her pain, only alleviate it",5,false
238,analogous,"comparable in certain respects, typically in a way which makes clearer the nature of the things compared","""they saw the relationship between a ruler and his subjects as�analogous to�that of father and children",5,false
239,bolster,support or strengthen,the fall in interest rates is starting to bolster confidence,5,false
240,chauvinistic,feeling or displaying aggressive or exaggerated patriotism,"The idea was absurd, even for someone as chauvinistic as Romas",4,false
241,dissemble,conceal or disguise one's true feelings or beliefs,"an honest, sincere person with no need to dissemble",4,false
242,dogged,having or showing tenacity and grim persistence,success required dogged determination,5,false
243,dupe,deceive; trick,the newspaper was duped into publishing an untrue story,6,false
244,empirical,based on observation or experience rather than theory or pure logic,they provided considerable empirical evidence to support their argument,5,false
245,engender,"cause or give rise to (a feeling, situation or condition)",the issue engendered continuing controversy,4,false
246,entitiled,believing oneself to be inherently deserving of privileges or special treatment,kids who feel so entitled and think the world will revolve around them,5,false
247,pertinacious,holding firmly to an opinion or a course of action,he worked with a pertinacious resistance to interruptions,4,false
248,probity,the quality of having strong moral principles; honesty and decency ,He asserted his innocence and his financial probity,3,true
249,proliferate,increase rapidly in number; multiply,the science fiction magazines which proliferated in the 1920s,3,true
250,spurious,false or fake,separating authentic and spurious claims,4,false
251,subjective,"based on or influenced by personal feelings, tastes or opinion",We know that taste in art is a subjective matter,5,false
252,subvert,undermine the power and authority of (an established system); overthrow,The rebel army is attempting to subvert the government,5,false
253,timorous,nervous or lacking confidence,The vast majority are most likely too timorous or too intimidated to do anything about it,4,false
254,tortuous,full of twists and turns; excessively lengthy and complex,the route is remote and tortuous,4,false
255,tractable,easy to control or influence,"she has always been tractable and obedient, even as a child",5,false
256,transient,lasting only for a short time; impermanent,here is a transient population of thousands of visitors during the year,5,false
257,ubiquitous,"present, appearing or found everywhere",his ubiquitous influence was felt by all the family,6,false
258,venal,corrupt,local customs officers are notoriously venal,5,false
259,venerate,regard with great respect,Robert Burns is Scotland's most venerated poet,4,false
260,arbitrary,based on random choice or personal whim; unrestrained and autocratic in the use of authority,Arbitrary arrests and detention without trial were common,2,false
261,archaic,very old or old-fashioned,prisons are run on archaic methods,2,false
262,clamorous,making a loud and confused noise; expressing or characterized by strong protests or demands,"they were active, and clamorous, and in subtle and not so subtle ways they corrupted the intellectual atmosphere",2,false
263,vehement,"showing strong feeling; forceful, passionate, or intense",her voice was low but vehement,2,false
264,dearth,a scarcity or lack of something,there is a dearth of evidence,2,false
265,explicable,able to be accounted for or understood,His behaviour is explicable in the light of his recent illness,2,false
266,hyperbole,exaggerated statements or claims not meant to be taken literally,"During the hurricane, it seemed as though the hyperbole, raining cats and dogs, was almost accurate",0,true
267,immutable,unchanging over time or unable to be changed,The actions of men are subject to general immutable laws expressed in statistics,2,false
268,indefatigable,persisting tirelessly,an indefatigable defender of human rights,2,false
269,indolent,lazy; causing little or no pain,Evidently Peter was determined to tear his son away from a life of indolent ease,0,true
270,insular,"ignorant of or unintrested in cultures, ideas or people outside one's own experience","At the moment, I'm a bit insular in my music tastes",2,false
271,intransigent,unwilling or refusing to change one's view or to change about something,"her father had tried persuasion, but she was intransigent",0,true
272,intrepid,fearless; adventurous,"Our speaker is an experienced, intrepid navigator who has sailed his boat through the Baltic sea to enter the Russian system",0,true
273,irreverent,showing a lack of respect for people or things that are generally taken seriously,Taylor combined great knowledge with an irreverent attitude to history,2,false
274,loathe,feeling intense dislike or disgust for,"I loathe these horrible roads, but I love the places they take you",2,false
275,malign,evil in nature; speak about (someone) in a spitefully critical manner,she had a strong and malign influence,1,true
276,malleable,easily influenced,they are as malleable and easily led as sheep,2,false
277,neophyte,novice; a new convert to a religion,four-day cooking classes are offered to neophytes and experts,2,false
278,plastic,not genuine; artificial or unnatural; easily shaped or moulded,rendering the material more plastic ,2,false
279,platitude,"a remark or statement, especially one with a moral content, that has been used too often to be interesting or thoughtful",he masks his disdain for her with platitudes about how she should believe in herself more,2,false
280,pristine,in its original condition; unspoilt,pristine copies of an early magazine,2,false
281,reproach,express to (someone) one's disapproval of or disappointment in their actions,her friends reproached her for not thinking enough about her family,0,true
282,robust,strong and healthy; vigorous; (of wine or food) strong and rich in flavour or smell,No handshake for Julie; she gave each of us a robust hug,2,false
283,salubrious,healthy; (of a place) pleasant,odours of far less salubrious origin,0,true
284,sanction,a threatened penalty for disobeying a law or rule; official permission of approval for an action,a range of sanctions aimed at deterring insider abuse,2,false
285,sedulous,showing dedication and diligence,he watched himself with the most sedulous care,0,true
286,soporific,tending to induce drowsiness or sleep,the motion of the train had a somewhat soporific effect,0,true
287,stern,"serious and unrelenting, especially in the assertion of authority and exercise of discipline",She issued a stern warning to those who persist in violence,2,false
288,tendentious,"expressing or promoting a particular cause or point of view, especially a controversial one",The president was tendentious on his plan for the company and would not listen to other options,2,false
